contig	input_name	organism	virus_seq_length	end_feature	gene_count	virion_hallmark_count	rep_hallmark_count	RDRP_hallmark_count	virion_hallmark_genes	rep_hallmark_genes	RDRP_hallmark_genes	taxonomy_hierarchy	ORF_caller	gcode	avg_read_depth
ct3_caudo_2a_91	NC_047770.1 |Escherichia phage ESCO13, complete genome	Phapecoctavirus sp. ctUHH4N	149813	None	286	14	2	0	Large Terminase|Portal protein|Putative phage serine protease XkdF|Head decoration protein|Major Capsid protein|Virion morphogenesis family|Minor capsid protein|tail sheath|tail tape measure protein |Tail protein|Baseplate wedge protein|tail fibre assembly protein|Tailspike protein|Tailspike protein	DNA polymerase B|DNA polymerase		d_Viruses;-_Duplodnaviria;k_Heunggongvirae;p_Uroviricota;c_Caudoviricetes;-_Stephanstirmvirinae;g_Phapecoctavirus	prodigal-gv	11	NaN
ct3_caudo_2a_92	OQ729742.1 |Proteus phage MidiMira-UFV02, complete genome	Autographiviridae sp. ctIJ84Z	43026	None	50	10	1	0	virion assembly protein|Head Tail Connector Protein|capsid assembly protein|Major Capsid Protein|Tail tube protein|Phage stabilisation protein|Predicted internal virion protein B |tail fibre protein|Small terminase subunit |Large Terminase	DNA polymerase		d_Viruses;-_Duplodnaviria;k_Heunggongvirae;p_Uroviricota;c_Caudoviricetes;f_Autographiviridae	prodigal-gv	11	NaN
ct3_caudo_2a_93	MH450131.1 |Arthrobacter phage Sergei, complete genome	Korravirus sp. ctQJHQC	43950	None	60	13	1	0	Large Terminase|Portal protein|prohead serine protease|Major Capsid Protein|head to tail adaptor|Minor capsid protein|type I neck protein|tail completion protein|tail protein |minor tail protein |Putative structural protein |Putative structural protein |Minor capsid protein	Helicase of the snf2 family		d_Viruses;-_Duplodnaviria;k_Heunggongvirae;p_Uroviricota;c_Caudoviricetes;g_Korravirus	prodigal-gv	11	NaN
ct3_caudo_2a_94	OM716005.1 |Aeromonas phage vB_ AhaP_PT2, complete genome	Autographiviridae sp. ct5A6CX	41289	DTR	53	13	1	0	tail fibre protein|tail needle knob|Terminase|Terminase|virion assembly protein|Head Tail Connector Protein|capsid assembly protein|Major Capsid protein|Tail tube protein|Phage stabilisation protein|internal virion protein |Predicted internal virion protein B |internal virion protein C	DNA polymerase		d_Viruses;-_Duplodnaviria;k_Heunggongvirae;p_Uroviricota;c_Caudoviricetes;f_Autographiviridae	prodigal-gv	11	NaN
ct3_caudo_2a_95	MT497232.1 |Rheinheimera phage vB_RspM_barba_10-9E, complete genome	Barbavirus sp. ctNIVJV	80556	None	141	11	4	0	tail fiber protein|Baseplate protein |Baseplate wedge protein|Tail protein|tail tape measure protein |tail sheath|Minor capsid protein|Virion morphogenesis family|Major Capsid protein|Portal Protein|Large Terminase	DNA Polymerase I|DNA polymerase|DNA polymerase|DNA polymerase II, small subunit		d_Viruses;-_Duplodnaviria;k_Heunggongvirae;p_Uroviricota;c_Caudoviricetes;g_Barbavirus	prodigal-gv	11	NaN
ct3_caudo_2a_96	NC_055841.1 |Agrobacterium phage OLIVR5, complete genome	Heverleevirus sp. ctORMR4	151073	None	235	26	3	0	Head decoration protein |Tail fibre adhesin|Tail fibre adhesin|Head decoration protein |Baseplate wedge protein|Baseplate wedge protein|Baseplate wedge protein|Baseplate wedge protein|Terminase DNA packaging enzyme|Large Terminase|baseplate protein|Baseplate wedge protein|Major Capsid Protein|tail sheath|Baseplate wedge protein|capsid assembly protein|Prohead core protein protease|Major Capsid Protein|Baseplate wedge protein|Baseplate wedge protein|Baseplate|phage neck protein|Virus neck protein|Tail connector protein|Baseplate wedge protein|baseplate wedge subunit	DNA helicase|DNAB Like Replicative Helicase|XPD; HELICAS		d_Viruses;-_Duplodnaviria;k_Heunggongvirae;p_Uroviricota;c_Caudoviricetes;f_Pootjesviridae;g_Heverleevirus	prodigal-gv	11	NaN
ct3_caudo_2a_97	MN694500.1 |MAG: Marine virus AFVG_250M1198, complete genome	Caudoviricetes sp. ct9AD62	39793	DTR	58	10	0	0	head to tail adaptor|Stabilisation protein|Small Terminase|Large Terminase|Portal Protein|Portal Protein|Scaffold protein |Major Capsid Protein|head to tail adaptor|tail fiber protein 			d_Viruses;-_Duplodnaviria;k_Heunggongvirae;p_Uroviricota;c_Caudoviricetes	prodigal-gv	11	NaN
ct3_caudo_2a_98	NC_005135.1 |Aeromonas phage 44RR2.8t, complete genome	Biquartavirus sp. ctR7EJL	173591	None	267	37	3	0	Major Capsid Protein|Head assembly protein|DNA packaging protein|Baseplate wedge protein|Baseplate|baseplate wedge subunit|baseplate wedge subunit|baseplate wedge subunit|baseplate wedge subunit|baseplate wedge tail fiber connector|Baseplate wedge protein|baseplate wedge subunit and tail pin|Baseplate wedge protein|Neck protein |Virus neck protein|Tail connector protein|small terminase|Large Terminase|tail sheath|Baseplate wedge protein|portal vertex protein|Prohead core protein|Prohead core protein protease|Scaffold protein |Major Capsid protein|tail needle knob|capsid vertex protein|Capsid vertex protein|Baseplate wedge protein|baseplate protein|baseplate assembly protein|baseplate hub subunit|Baseplate hub distal subunit|Baseplate hub distal subunit|baseplate protein|baseplate protein|Long tail fiber	DNAB Like Replicative Helicase|DNA helicase|DNA helicase		d_Viruses;-_Duplodnaviria;k_Heunggongvirae;p_Uroviricota;c_Caudoviricetes;f_Straboviridae;g_Biquartavirus	prodigal-gv	11	NaN
ct3_caudo_2a_99	MK327936.1 |Escherichia phage vB_EcoM_G2540, complete genome	Tequatrovirus sp. ct8BMFX	168886	None	276	38	3	0	Small outer capsid protein|Major Capsid Protein|Head assembly protein|Baseplate wedge protein|Baseplate wedge protein|Baseplate|baseplate wedge subunit|baseplate wedge subunit|T4 baseplate structural protein|baseplate wedge tail fiber connector|Baseplate wedge protein|baseplate wedge subunit|baseplate wedge subunit and tail pin|Long tail fiber|Neck protein |Neck protein|tail sheath stabilizer|Terminase DNA packaging enzyme|Large Terminase|tail sheath|Baseplate wedge protein|capsid assembly protein|Prohead core protein|Prohead core protein protease|Scaffold protein |Major Capsid Protein|capsid vertex protein|head outer capsid protein |Baseplate wedge protein|baseplate protein|baseplate assembly protein|baseplate hub subunit|Baseplate hub distal subunit|Baseplate hub distal subunit|baseplate protein|baseplate protein|Long tail fiber|tail fibre adhesin	DNAB Like Replicative Helicase|DNA helicase|DNA helicase		d_Viruses;-_Duplodnaviria;k_Heunggongvirae;p_Uroviricota;c_Caudoviricetes;f_Straboviridae;-_Tevenvirinae;g_Tequatrovirus	prodigal-gv	11	NaN
